{
  "credential": {
    "authentication_scheme": "Bearer",
    "credential_id": "credential_receiving_resume",
    "expires_at": "2026-08-20T10:00:00Z",
    "replay_completion_id": null,
    "state": "active"
  },
  "exchange_id": "exchange_receiving_resume",
  "exchange_kind": "resume_session",
  "exchange_receipt_digest": "sha256:fc1e4de85ba4ae7a29b4865010a5d8d8e816c4eec3faf75000865be5d6241b3f",
  "issued_at": "2026-07-21T10:02:02Z",
  "message_type": "launch_exchange_receipt",
  "previous_credential_revocation": {
    "credential_id": "credential_synthetic",
    "revoked_at": "2026-07-21T10:02:02Z",
    "state": "revoked"
  },
  "protocol_version": "tacua.sdk-backend@1.0.0",
  "received_at": "2026-07-21T10:02:02Z",
  "request_digest": "sha256:138febebf0e629b3847098aa22e8b8f3a89a7c1174d3caf6ca7a795359a07081",
  "scope": {
    "application_id": "app_synthetic",
    "build_id": "build_synthetic",
    "build_identity_digest": "sha256:53effba69a9d01818c4bf41763e97833cc3dc46ab45c9fd7a1e027b8e1707c91",
    "capture_scope": "app_only",
    "consent": {
      "diagnostics": "granted",
      "granted_at": "2026-07-21T09:56:00Z",
      "microphone": "granted",
      "policy_version": "tacua.consent-v1",
      "raw_media_upload": "granted",
      "screen_recording": "granted"
    },
    "message_type": "capture_scope",
    "organization_id": "org_synthetic",
    "project_id": "project_synthetic",
    "protocol_version": "tacua.sdk-backend@1.0.0",
    "retention": {
      "derived_data_days": 30,
      "policy_version": "tacua.retention-v1",
      "raw_media_days": 30
    },
    "scope_digest": "sha256:c38600d56cdb3bc8a0d94c0dd7e6323f863d1ccbc6953b6c71421e7c08512a20"
  },
  "session_id": "session_synthetic",
  "session_state": "receiving"
}
