{
  "credential": {
    "authentication_scheme": "Bearer",
    "credential_id": "credential_synthetic",
    "expires_at": "2026-08-20T10:00:00Z",
    "replay_completion_id": null,
    "state": "active"
  },
  "exchange_id": "exchange_synthetic",
  "exchange_kind": "start_session",
  "exchange_receipt_digest": "sha256:c2909c7e618bc13faa711324fd33e3a07b5d8d70f89f7dc9060b2f7958975616",
  "issued_at": "2026-07-21T09:57:01Z",
  "message_type": "launch_exchange_receipt",
  "previous_credential_revocation": null,
  "protocol_version": "tacua.sdk-backend@1.0.0",
  "received_at": "2026-07-21T09:57:01Z",
  "request_digest": "sha256:bec4fc6cbafd83fb5b761e44fbe1319c861e1a24739e598acb66d0570a80af04",
  "scope": {
    "application_id": "app_synthetic",
    "build_id": "build_synthetic",
    "build_identity_digest": "sha256:53effba69a9d01818c4bf41763e97833cc3dc46ab45c9fd7a1e027b8e1707c91",
    "capture_scope": "app_only",
    "consent": {
      "diagnostics": "granted",
      "granted_at": "2026-07-21T09:56:00Z",
      "microphone": "granted",
      "policy_version": "tacua.consent-v1",
      "raw_media_upload": "granted",
      "screen_recording": "granted"
    },
    "message_type": "capture_scope",
    "organization_id": "org_synthetic",
    "project_id": "project_synthetic",
    "protocol_version": "tacua.sdk-backend@1.0.0",
    "retention": {
      "derived_data_days": 30,
      "policy_version": "tacua.retention-v1",
      "raw_media_days": 30
    },
    "scope_digest": "sha256:c38600d56cdb3bc8a0d94c0dd7e6323f863d1ccbc6953b6c71421e7c08512a20"
  },
  "session_id": "session_synthetic",
  "session_state": "receiving"
}
