{
  "credential": {
    "authentication_scheme": "Bearer",
    "credential_id": "credential_completed_resume",
    "expires_at": "2026-08-20T10:00:00Z",
    "replay_completion_id": "completion_synthetic",
    "state": "completion_replay_or_delete_only"
  },
  "exchange_id": "exchange_completed_resume",
  "exchange_kind": "resume_session",
  "exchange_receipt_digest": "sha256:f1cfa92ec65e34647f4837253c2f43d257b567c013be2f1d13f3e67d2e821f43",
  "issued_at": "2026-07-21T10:02:21Z",
  "message_type": "launch_exchange_receipt",
  "previous_credential_revocation": {
    "credential_id": "credential_receiving_resume",
    "revoked_at": "2026-07-21T10:02:21Z",
    "state": "revoked"
  },
  "protocol_version": "tacua.sdk-backend@1.0.0",
  "received_at": "2026-07-21T10:02:21Z",
  "request_digest": "sha256:e94d47b375fe58f038373479c4f2972bfe1b79d589e557bf91f12963be6ce5c0",
  "scope": {
    "application_id": "app_synthetic",
    "build_id": "build_synthetic",
    "build_identity_digest": "sha256:53effba69a9d01818c4bf41763e97833cc3dc46ab45c9fd7a1e027b8e1707c91",
    "capture_scope": "app_only",
    "consent": {
      "diagnostics": "granted",
      "granted_at": "2026-07-21T09:56:00Z",
      "microphone": "granted",
      "policy_version": "tacua.consent-v1",
      "raw_media_upload": "granted",
      "screen_recording": "granted"
    },
    "message_type": "capture_scope",
    "organization_id": "org_synthetic",
    "project_id": "project_synthetic",
    "protocol_version": "tacua.sdk-backend@1.0.0",
    "retention": {
      "derived_data_days": 30,
      "policy_version": "tacua.retention-v1",
      "raw_media_days": 30
    },
    "scope_digest": "sha256:c38600d56cdb3bc8a0d94c0dd7e6323f863d1ccbc6953b6c71421e7c08512a20"
  },
  "session_id": "session_synthetic",
  "session_state": "completed"
}
